{"$defs":{"reference":{"additionalProperties":false,"properties":{"path":{"type":"string"},"sha256":{"pattern":"^[0-9a-f]{64}$","type":"string"}},"required":["path","sha256"],"type":"object"}},"$id":"urn:lykoi:training-episode:1","$schema":"https://json-schema.org/draft/2020-12/schema","additionalProperties":false,"properties":{"acceptance_identity":{"$ref":"#/$defs/reference"},"admission_blockers":{"items":{"type":"string"},"type":"array"},"admission_status":{"enum":["TRAINING_ADMITTED","VALIDATED_LIMITED_EVIDENCE","CAPABILITY_GAP","REQUIREMENT_CLARIFICATION_REQUIRED","ACCEPTANCE_GAP","IMPLEMENTATION_FAILURE","PROVENANCE_OR_LEAKAGE_GAP"]},"episode_id":{"pattern":"^E[0-9]{2}$","type":"string"},"executable_artifact_identity":{"oneOf":[{"$ref":"#/$defs/reference"},{"type":"null"}]},"family_id":{"pattern":"^F[1-6]$","type":"string"},"formal_requirement_contract":{"$ref":"#/$defs/reference"},"original_requirement":{"type":"string"},"partition_assignment":{"enum":["development","evaluation_quarantine"]},"provenance_classification":{"const":"SAME_COORDINATOR_EXPOSED"},"replay_evidence":{"items":{"$ref":"#/$defs/reference"},"type":"array"},"schema_version":{"const":"lykoi-training-episode-1"},"scripted_trajectory_identity":{"oneOf":[{"$ref":"#/$defs/reference"},{"type":"null"}]},"semantic_profile":{"type":"string"},"source_identity":{"$ref":"#/$defs/reference"},"symbolic_artifact_identity":{"oneOf":[{"$ref":"#/$defs/reference"},{"type":"null"}]},"technical_status":{"enum":["TRAINING_ADMITTED","VALIDATED_LIMITED_EVIDENCE","CAPABILITY_GAP","REQUIREMENT_CLARIFICATION_REQUIRED","ACCEPTANCE_GAP","IMPLEMENTATION_FAILURE","PROVENANCE_OR_LEAKAGE_GAP"]},"tool_trajectory_identity":{"oneOf":[{"$ref":"#/$defs/reference"},{"type":"null"}]},"validation_status":{"enum":["VALID","NOT_REACHED","NOT_REPRESENTABLE"]}},"required":["schema_version","episode_id","family_id","original_requirement","source_identity","formal_requirement_contract","semantic_profile","symbolic_artifact_identity","executable_artifact_identity","tool_trajectory_identity","scripted_trajectory_identity","acceptance_identity","validation_status","replay_evidence","provenance_classification","partition_assignment","admission_status","technical_status","admission_blockers"],"title":"Lykoi training episode 1","type":"object"}
