{"acceptance_identity":{"path":"benchmark/results/phase6/r6_48/episodes/E06/ACCEPTANCE.json","sha256":"8b0a2231e08d5e729be93a0232e9a08b6ebf115aca9bc5284cb8a6e92cd8b1e7"},"admission_blockers":["independent commissioning unavailable","independent acceptance review unavailable","same-coordinator repository/evaluation exposure"],"admission_status":"PROVENANCE_OR_LEAKAGE_GAP","episode_id":"E06","executable_artifact_identity":{"path":"benchmark/results/phase6/r6_48/episodes/E06/EXECUTABLE.json","sha256":"68e37a1b8131b3f0aab98586a0fa8fae7c98fba77115930e0d6d0550c7fb397d"},"family_id":"F3","formal_requirement_contract":{"path":"benchmark/results/phase6/r6_48/episodes/E06/FRC.json","sha256":"9736ed481f38afa8e2588645146fd0f1cfe648c91e80b852c1dc4c20456be0bd"},"original_requirement":"Read exactly three bytes: low, high and reading. Read all three before any check. Reject low greater than high as WINDOW at low; otherwise reject reading below low as BELOW at reading, then reject reading above high as ABOVE at reading. Perform trailing-data rejection last. Return reading as UInt16BE.","partition_assignment":"development","provenance_classification":"SAME_COORDINATOR_EXPOSED","replay_evidence":[{"path":"benchmark/results/phase6/r6_48/REPLAY-1.json","sha256":"069186c5fbb387ab3f990d4df4f95325591a0d343b5042cd008fd2f0ae797d28"},{"path":"benchmark/results/phase6/r6_48/REPLAY-2.json","sha256":"b548faccb3ba705c1d22dd136aa26b6139591381a5c3cf17cf3e261b3d3c1a60"},{"path":"benchmark/results/phase6/r6_48/REPLAY-3.json","sha256":"3bbe03db28ddb380e5f1b911d691373ec5addead7d46af8ce8962cb15c493f7e"}],"schema_version":"lykoi-training-episode-1","scripted_trajectory_identity":{"path":"benchmark/results/phase6/r6_48/episodes/E06/SCRIPTED-TRAJECTORY.json","sha256":"555b4e6c42b92b0ac1d837bf81157963c32c14f1de5a993fe38dd1d1c0778c64"},"semantic_profile":"typed-composition-1","source_identity":{"path":"benchmark/results/phase6/r6_48/episodes/E06/SOURCE.json","sha256":"4d37a78ed5953cc71e01284a1f6b4b409a0a326f4735b80b44e4fbf7926ff7db"},"symbolic_artifact_identity":{"path":"benchmark/results/phase6/r6_48/episodes/E06/SYMBOLIC.json","sha256":"3e2f37c41863cdf9b17c96dd7124bb490d54ff1ca4bf6e1a5cfd5d8bcfdadec0"},"technical_status":"VALIDATED_LIMITED_EVIDENCE","tool_trajectory_identity":null,"validation_status":"VALID"}
